{"$schema":"https://json-schema.org/draft/2020-12/schema","title":"JiuwenSwarm v4 review","type":"object","required":["evidence_assessment","unsupported_claims","citation_coverage","allow_paper","human_intervention_required"],"properties":{"evidence_assessment":{"type":"array"},"unsupported_claims":{"type":"array","items":{"type":"string"}},"citation_coverage":{"type":"number"},"allow_paper":{"type":"boolean"},"human_intervention_required":{"type":"boolean"}},"additionalProperties":false}