{
  "evidence_assessment": [
    {
      "metric": "UCR_no-rail",
      "value": 0.5556
    },
    {
      "metric": "UCR_prompt-only",
      "value": 0.0
    },
    {
      "metric": "UCR_full-rail",
      "value": 0.0
    },
    {
      "metric": "task_success_rate_no-rail",
      "value": 1.0
    },
    {
      "metric": "task_success_rate_prompt-only",
      "value": 1.0
    },
    {
      "metric": "task_success_rate_full-rail",
      "value": 1.0
    },
    {
      "metric": "rail_attempts_full-rail",
      "value": 1
    },
    {
      "metric": "rail_accepted_full-rail",
      "value": 1
    }
  ],
  "unsupported_claims": [
    "claim-002",
    "claim-003",
    "claim-005",
    "claim-007",
    "claim-009",
    "claim-018",
    "claim-019",
    "claim-020"
  ],
  "citation_coverage": 0.0,
  "allow_paper": false,
  "human_intervention_required": true
}
