{
  "evidence_assessment": [
    {
      "metric": "UCR_no_rail",
      "value": 0.5556
    },
    {
      "metric": "UCR_prompt_only",
      "value": 0.0
    },
    {
      "metric": "UCR_full_rail",
      "value": 0.0
    },
    {
      "metric": "task_success_rate_no_rail",
      "value": 1.0
    },
    {
      "metric": "task_success_rate_prompt_only",
      "value": 1.0
    },
    {
      "metric": "task_success_rate_full_rail",
      "value": 1.0
    },
    {
      "metric": "rail_attempts_full_rail",
      "value": 1
    },
    {
      "metric": "max_material_relevance_score",
      "value": 0.32
    }
  ],
  "unsupported_claims": [
    "claim-002",
    "claim-003",
    "claim-005",
    "claim-007",
    "claim-009",
    "claim-018",
    "claim-019",
    "claim-020"
  ],
  "citation_coverage": 0.0,
  "allow_paper": false,
  "human_intervention_required": true
}
