{
  "evidence_assessment": [
    {
      "metric": "no-rail UCR",
      "value": 0.5556
    },
    {
      "metric": "prompt-only UCR",
      "value": 0.0
    },
    {
      "metric": "full-rail UCR",
      "value": 0.0
    },
    {
      "metric": "no-rail supported decisions",
      "value": 4
    },
    {
      "metric": "no-rail unexecuted decisions",
      "value": 5
    },
    {
      "metric": "prompt-only supported decisions",
      "value": 4
    },
    {
      "metric": "prompt-only unexecuted decisions",
      "value": 0
    },
    {
      "metric": "full-rail supported decisions",
      "value": 4
    },
    {
      "metric": "full-rail unexecuted decisions",
      "value": 0
    },
    {
      "metric": "full-rail rail.attempts",
      "value": 1
    },
    {
      "metric": "task_success_rate all arms",
      "value": 1.0
    }
  ],
  "unsupported_claims": [
    "claim-002",
    "claim-003",
    "claim-005",
    "claim-007",
    "claim-009",
    "claim-018",
    "claim-019",
    "claim-020"
  ],
  "citation_coverage": 0.0,
  "allow_paper": false,
  "human_intervention_required": true
}
